{
  "schema_version": 2,
  "request_id": "aaaaaaaa-bbbb-4ccc-8ddd-eeeeeeeeeeee",
  "status": "completed",
  "code": "Ok",
  "message": "Sampling settings applied; every source still honors its capability floor.",
  "config_revision": 2,
  "effective_interval_ms": 1000,
  "action_state": null,
  "confirmation_token": null,
  "expires_boot_ns": null
}
